{
  "$schema": "https://json-schema.org/draft/2020-12/schema",
  "$id": "https://forever.works/schemas/0.1/decision.schema.json",
  "title": "Decision",
  "description": "Canonical Forever Works decision record. Unknown fields are preserved for compatible extension.",
  "type": "object",
  "required": [
    "foreverVersion",
    "id",
    "kind",
    "title",
    "status",
    "context",
    "decision",
    "rationale"
  ],
  "properties": {
    "foreverVersion": {
      "type": "string",
      "pattern": "^0\\.[0-9]+$",
      "description": "Forever Works schema version."
    },
    "id": {
      "type": "string",
      "pattern": "^[a-z][a-z0-9]*(?:[._-][a-z0-9]+)*$",
      "description": "Stable, globally unique entity identifier."
    },
    "kind": {
      "const": "decision"
    },
    "provenance": {
      "$ref": "common.schema.json#/$defs/provenance"
    },
    "extensions": {
      "type": "object",
      "propertyNames": {
        "pattern": "^[a-z0-9]+(?:[.-][a-z0-9]+)+$"
      },
      "additionalProperties": true
    },
    "title": {
      "type": "string"
    },
    "status": {
      "type": "string"
    },
    "context": {
      "type": "string"
    },
    "decision": {
      "type": "string"
    },
    "alternativesConsidered": {
      "type": "array",
      "items": {
        "type": "string"
      },
      "uniqueItems": true,
      "description": "Ordered descriptive strings; not entity references."
    },
    "rationale": {
      "type": "string"
    },
    "assumptions": {
      "type": "array",
      "items": {
        "type": "string"
      },
      "uniqueItems": true,
      "description": "Ordered descriptive strings; not entity references."
    },
    "mayChange": {
      "type": "array",
      "items": {
        "type": "string"
      },
      "uniqueItems": true,
      "description": "Ordered descriptive strings; not entity references."
    },
    "mustSurvive": {
      "type": "array",
      "items": {
        "type": "string"
      },
      "uniqueItems": true,
      "description": "Ordered descriptive strings; not entity references."
    },
    "revisitConditions": {
      "type": "array",
      "items": {
        "type": "string"
      },
      "uniqueItems": true,
      "description": "Ordered descriptive strings; not entity references."
    },
    "relatedEntities": {
      "type": "array",
      "items": {
        "type": "string"
      },
      "uniqueItems": true,
      "description": "Stable entity ID references."
    },
    "dateVersion": {
      "type": "string"
    }
  },
  "additionalProperties": true,
  "examples": [
    {
      "foreverVersion": "0.1",
      "id": "decision.example",
      "kind": "decision",
      "title": "Use JSON",
      "status": "accepted",
      "context": "Need portability.",
      "decision": "Use JSON.",
      "rationale": "Open format."
    }
  ]
}
